<cluster xmlns:xsi="http://www.w3.org/2001/XMLSchema-instance"
	xsi:noNamespaceSchemaLocation="zigbee-description.xsd" code="0x0407">
    <name>Leaf Wetness Measurement</name>
    <description>The server cluster provides an interface to read the percentage of water on the leaves of plants.</description>
    <attribute code="0x0000" type="UNSIGNED_16_BIT_INTEGER" side="server" optional="false" writable="false" reportable="true">
        <name>Measured Value</name>
        <description>MeasuredValue represents the leaf wetness in % as follows:-</description>
        <description>MeasuredValue = 100 x Leaf Wetness</description>
        <description>Where 0% &lt;= leaf wetness &lt;= 100%, corresponding to a MeasuredValue in the range 0 to 0x2710.</description>
        <description>The maximum resolution this format allows is 0.01%.</description>
        <description>A MeasuredValue of 0xffff indicates that the measurement is invalid.</description>
        <description>MeasuredValue is updated continuously as new measurements are made.</description>
    </attribute>
    <attribute code="0x0001" type="UNSIGNED_16_BIT_INTEGER" side="server" optional="false" writable="false" reportable="false" minimum="0x0000" maximum="0x270F">
        <name>Min Measured Value</name>
        <description>The MinMeasuredValue attribute indicates the minimum value of MeasuredValue that can be measured. A value of 0xffff means this attribute is not defined</description>
    </attribute>
    <attribute code="0x0002" type="UNSIGNED_16_BIT_INTEGER" side="server" optional="false" writable="false" reportable="false" minimum="0x0001" maximum="0x2710">
        <name>Max Measured Value</name>
        <description>The MaxMeasuredValue attribute indicates the maximum value of MeasuredValue that can be measured. A value of 0xffff means this attribute is not defined.</description>
        <description>MaxMeasuredValue shall be greater than MinMeasuredValue.</description>
        <description>MinMeasuredValue and MaxMeasuredValue define the range of the sensor.</description>
    </attribute>
    <attribute code="0x0003" type="UNSIGNED_16_BIT_INTEGER" side="server" optional="true" writable="false" reportable="true" minimum="0x0000" maximum="0x0800">
        <name>Tolerance</name>
        <description>The Tolerance attribute indicates the magnitude of the possible error that is associated with MeasuredValue . The true value is located in the range (MeasuredValue &#8211; Tolerance) to (MeasuredValue + Tolerance).</description>
    </attribute>

</cluster>
